<?xml version="1.0"?>
<simulation xmlns:xsi="http://www.w3.org/2001/XMLSchema-instance"
       xsi:noNamespaceSchemaLocation="src/simulation.xsd">
       
	<domain X="63" Y="36" Z="1"/>
	<rCutOf>3</rCutOf>
	<type sigma="1" epsilon="1" mass="1"/>
	<type sigma="0.9412" epsilon="1" mass="2"/>
	<cuboid type="0">
		<position X="0.6" Y="2.0" Z="0"/>
		<initialVelocity X="0.0" Y="0.0" Z="0.0"/>
		<particleCount X="50" Y="14" Z="1"/>
		<spacing>1.2</spacing>
	</cuboid>
	<cuboid type="1">
		<position X="0.6" Y="19" Z="0"/>
		<initialVelocity X="0.0" Y="0.0" Z="0.0"/>
		<particleCount X="50" Y="14" Z="1"/>
		<spacing>1.2</spacing>
	</cuboid>
</simulation>