<?xml version="1.0"?>
<simulation xmlns:xsi="http://www.w3.org/2001/XMLSchema-instance"
       xsi:noNamespaceSchemaLocation="simulation.xsd">
       
    <thermostat>
  		<initialTemp>40</initialTemp>
  		<targetTemp>40</targetTemp>
  		<step>1000</step>
  		<startTime>-1</startTime>
      <targetTime>0</targetTime>
  	</thermostat>
  	<gravity>-12.5</gravity>
	<domain X="150" Y="27" Z="1"/>
  <boundaries Left="2" Right="3" Bottom="1" Top="1"/>
	<rCutOff>3</rCutOff>
	<type sigma="1.2" epsilon="1" mass="1"/>
	<type sigma="1.1" epsilon="1" mass="2"/>
	<cuboid type="0">
		<position X="0.6" Y="2.0" Z="0"/>
		<initialVelocity X="0.0" Y="0.0" Z="0.0"/>
		<particleCount X="125" Y="10" Z="1"/>
		<spacing>1.2</spacing>
	</cuboid>
	<cuboid type="1">
		<position X="0.6" Y="14" Z="0"/>
		<initialVelocity X="0.0" Y="0.0" Z="0.0"/>
		<particleCount X="125" Y="10" Z="1"/>
		<spacing>1.2</spacing>
	</cuboid>
</simulation>