<?xml version="1.0"?>
<simulation xmlns:xsi="http://www.w3.org/2001/XMLSchema-instance"
       xsi:noNamespaceSchemaLocation="simulation.xsd">
	<thermostat>
		<numDimensions>2</numDimensions>
  		<initialTemp>20</initialTemp>
  		<targetTemp>20</targetTemp>
  		<step>500</step>
  		<startTime>0</startTime>
      <targetTime>0</targetTime>
  	</thermostat>
  	<gravity>-12.5</gravity>
	<domain X="111" Y="63" Z="1"/>
  	<boundaries Left="3" Right="3" Bottom="2" Top="2"/>  	
  	<wallType>1</wallType>
	<rCutOff>3</rCutOff>
	<type sigma="1" epsilon="5" mass="1"/>
	<type sigma="1" epsilon="5" mass="100"/>
	<cuboid type="0">
		<position X="10.0" Y="5.0" Z="0"/>
		<initialVelocity X="0.0" Y="0.0" Z="0.0"/>
		<particleCount X="80" Y="20" Z="1"/>
		<spacing>1.125</spacing>
	</cuboid>
	<cuboid type="0">
		<position X="60" Y="35" Z="0"/>
		<initialVelocity X="0.0" Y="0.0" Z="0.0"/>
		<particleCount X="20" Y="20" Z="1"/>
		<spacing>1.125</spacing>
	</cuboid>
	<particles>
		<particle type="1">
			<position X="30.5" Y="50" Z="0"/>
			<velocity X="0.0" Y="-1.0" Z="0.0"/>
		</particle>
	</particles>
</simulation>